{
  "assetId": "mysubasset943857123",
  "assetDescription": "Generic Sub-Asset object",
  "assetStatus": "Installed",
  "secondaryAttributes": [
    {
      "name": "admsId",
      "value": "346-43564574",
      "category": "ADMS",
      "dataType": "admsId"
    },
    {
      "name": "otherNotes",
      "value": "Near the brick wall in the substation",
      "category": "ADMS",
      "dataType": "string"
    },
    {
      "name": "gisId",
      "value": "12344534",
      "dataType": "gisId"
    }
  ],
  "workOrders": [
    {
      "workOrderId": "WO283745636485",
      "workDescription": "Inspect the asset",
      "startDate": "12/05/19",
      "workOrderStatus": "Complete",
      "assetId": "myasset123",
      "secondaryAttributes": [
        {
          "name": "warning",
          "value": "Beware of the dog",
          "category": "WFM",
          "dataType": "string"
        }
      ]
    },
    {
      "workOrderId": "WO283745636485",
      "workDescription": "Fix the asset",
      "startDate": "14/05/19",
      "workOrderStatus": "Complete",
      "assetId": "myasset123",
      "secondaryAttributes": [
        {
          "name": "warning",
          "value": "Beware of the dog",
          "category": "WFM",
          "dataType": "string"
        }
      ]
    }
  ],
  "location": {
    "locationId": "L2378462378",
    "geometry": {
      "type": "Point",
      "coordinates": [ 34.23, -57.56 ]
    }
  }
}
