{
  "assetId": "DE-myasset123",
  "assetDescription": "Generic Asset 12345",
  "assetStatus": "Under Repair",
  "secondaryAttributes": [
    {
      "name": "admsId",
      "value": {
        "id": "346-43564574"
      },
      "category": "ADMS",
      "dataType": "admsId"
    },
    {
      "name": "otherNotes",
      "value": {
        "val": "Near the brick wall in the substation"
      },
      "category": "ADMS",
      "dataType": "string"
    },
    {
      "name": "gisId",
      "value": {
        "id": "12344534"
      },
      "dataType": "gisId"
    }
  ],
  "workOrders": [
    {
      "workOrderId": "WO283745636485",
      "workDescription": "Inspect the asset",
      "startDate": "12/05/19",
      "workOrderStatus": "Complete",
      "parentAssetId": "myasset123",
      "secondaryAttributes": [
        {
          "name": "warning",
          "value": "Beware of the dog",
          "category": "WFM",
          "dataType": "string"
        }
      ]
    },
    {
      "workOrderId": "WO283745636485",
      "workDescription": "Fix the asset",
      "startDate": "14/05/19",
      "workOrderStatus": "Complete",
      "parentAssetId": "myasset123",
      "secondaryAttributes": [
        {
          "name": "warning",
          "value": "Beware of the dog",
          "category": "WFM",
          "dataType": "string"
        }
      ]
    }
  ],
  "location": {
    "locationId": "L2378462378",
    "geometry": {
      "type": "Point",
      "coordinates": [ 34.23, -57.56 ]
    }
  },
  "subcomponents": [
    {
      "componentId": "mycomponent123",
      "componentDescription": "Generic component",
      "parentAssetId": "myasset123",
      "secondaryAttributes": [
        {
          "name": "colour",
          "value": "Pink",
          "category": "Appearance",
          "dataType": "string"
        }
      ],
      "assets": [],
      "subcomponents": []
    },
    {
      "componentId": "complexcomponent123",
      "componentDescription": "Generic component with a subcomponent",
      "parentAssetId": "myasset123",
      "secondaryAttributes": [
        {
          "name": "colour",
          "value": "Pink",
          "category": "Appearance",
          "dataType": "string"
        }
      ],
      "assets": [],
      "subcomponents": [
        {
          "componentId": "subcomponent123",
          "componentDescription": "A generic subcomponent with no children",
          "parentAssetId": "myasset123",
          "secondaryAttributes": [
            {
              "name": "colour",
              "value": "Pink",
              "category": "Appearance",
              "dataType": "string"
            }
          ],
          "assets": [],
          "subcomponents": []
        }
      ]
    }
  ]
}
