{
  "assetId": "DE-12763571265",
  "assetDescription": "Power Transformer in Big Substation",
  "assetStatus": "Installed",
  "secondaryAttributes": [
    {
      "name": "txtype",
      "value": {
        "txtype": "Power Transformer",
        "manufacturer": "ABB"
      },
      "dataType": "abb.eam.asset.utilities.transformer.secondaryattribute.txtype-1.0.0.json"
    },
    {
      "name": "txrating",
      "value": {
        "rating": "315 kVA"
      },
      "dataType": "abb.eam.asset.utilities.transformer.secondaryattribute.txrating-1.0.0.json"
    },
    {
      "name": "admsId",
      "value": {
        "id": "TX-P-3247"
      },
      "category": "ADMS"
    },
    {
      "name": "gisId",
      "value": {
        "id": "TX-3478564378"
      }
    }
  ],
  "location": {
    "locationId": "L2378462378",
    "geometry": {
      "type": "Point",
      "coordinates": [ 34.23, -57.56 ]
    }
  }
}
